Name,Website,Initiatives_aims,Type,Other_information,Collector,Region,Country,Tag,Data_origin,Spec_location,Mapping_location,country_iso,Latitude,Longitude
National Institute for Occupational Health (NIOH),https://www.nioh.ac.za/,"The National Health Laboratory Service’s (NHLS) Institute for Occupational Health (NIOH), is recognised internationally for excellence in research, services and training to support occupational health services not only in South Africa but also in Southern Africa through its extensive outreach activities and collaboration",Research organisation,NA,Nomalungelo Maphanga,Africa,South Africa,NA,Talarify OLS 6 project (https://openlifesci.org/ols-6/projects-participants/#mapping-the-rsse-landscape-in-africa),Johannesburg,South Africa,ZAF,-29,24
National Biobank,http://nationalbiobank.nhls.ac.za/,"The NHLS Biobank helps to secure and manage collections of biomaterials and its associated data for research, human health and biotechnology development, for the benefit of society. The NHLS Biobank was established in response to the growing burden of communicable and non- communicable diseases in South Africa",Research organisation,NA,Nomalungelo Maphanga,Africa,South Africa,NA,Talarify OLS 6 project (https://openlifesci.org/ols-6/projects-participants/#mapping-the-rsse-landscape-in-africa),Johannesburg,South Africa,ZAF,-29,24
South African Vaccine Producers (SAVP),http://www.savp.co.za/,"Its activities comprise of Diagnostic Laboratory Services, Research, Teaching and Training, and Production of Sera for Anti-Snake Venom, Reagents and Media.",Research organisation,NA,Nomalungelo Maphanga,Africa,South Africa,NA,Talarify OLS 6 project (https://openlifesci.org/ols-6/projects-participants/#mapping-the-rsse-landscape-in-africa),Johannesburg,South Africa,ZAF,-29,24
Agricultural Research Center (Egypt),http://www.arc.sci.eg/,"The overarching goal is to maximize the economic return per unit of land and water. Within the national agricultural development strategies, ARC assumes the following major functions:

Conducting applied and basic research to generate a continuous flow of technologies that help increase productivity and reduce production cost;

Transfer of new technologies to the farming community through extension service; and monitoring their adoption by the end users; and
Human capital development as a continual process.
",Research organisation,NA,Nomalungelo Maphanga,Africa,Egypt,NA,Talarify OLS 6 project (https://openlifesci.org/ols-6/projects-participants/#mapping-the-rsse-landscape-in-africa),NA,Egypt,EGY,27,30
South Arican Weather Service (SAWS),https://www.weathersa.co.za/,"The vision articulates clearly the desired end state in which SAWS is central to a situation where citizens, communities and business sectors are able to use the information, products and services across the weather, climate and related environmental space to support socio-economic development and build resilience.",Research organisation,NA,Nomalungelo Maphanga,Africa,South Africa,NA,Talarify OLS 6 project (https://openlifesci.org/ols-6/projects-participants/#mapping-the-rsse-landscape-in-africa),NA,South Africa,ZAF,-29,24
"CENTRE DE RECHERCHE SUR L'INFORMATION
SCIENTIFIQUE ET TECHNIQUE",https://www.cerist.dz/index.php/fr/,The Research Centre on Scientific and Technical Information is in charge of the fulfilment of research and development programs in the scientific and technical information field.,Research organisation,NA,Nomalungelo Maphanga,Africa,Algeria,NA,Talarify OLS 6 project (https://openlifesci.org/ols-6/projects-participants/#mapping-the-rsse-landscape-in-africa),NA,Algeria,DZA,28,3
African Astronomical Society (AfAS),https://www.africanastronomicalsociety.org/,A professional society that focuses on astronomy education and astronomy research.,Community,Based in SA but community membrs are from all over Africa.,Nomalungelo Maphanga,Africa,Multiple countries,NA,Talarify OLS 6 project (https://openlifesci.org/ols-6/projects-participants/#mapping-the-rsse-landscape-in-africa),Cape Town,Zambia,ZMB,-15,30
Agriculture Research Council (ARC),https://www.arc.agric.za/Pages/Home.aspx,Excellence in research and innovation for sustainable agricultural systems and economic development,Research organisation,NA,Nomalungelo Maphanga,Africa,South Africa,NA,Talarify OLS 6 project (https://openlifesci.org/ols-6/projects-participants/#mapping-the-rsse-landscape-in-africa),Multiple campuses,South Africa,ZAF,-29,24
THE APPLIED CENTRE FOR CLIMATE & EARTH SYSTEM SCIENCE (ACCESS),csir.co.za/applied-centre-climate-earth-system-science,"The Alliance for Collaboration on Climate and Earth Systems Science (ACCESS) is a CSIR-hosted platform for research, education, services and training related to a changing environment.",Research organisation,Hosted by the CSIR,Nomalungelo Maphanga,Africa,South Africa,NA,Talarify OLS 6 project (https://openlifesci.org/ols-6/projects-participants/#mapping-the-rsse-landscape-in-africa),NA,South Africa,ZAF,-29,24
Southern Africa Network for Biosciences (SANBio),https://www.csir.co.za/nepad-sanbio,"The Southern Africa Network for Biosciences (SANBio) is a shared biosciences research, development and innovation platform for working collaboratively to address some of southern Africa’s key biosciences issues in health, nutrition and health-related intervention areas such as agriculture and the environment.",Research organisation,"Hosted by the CSIR. Includes Angola, Botswana, Malawi, Mauritius, Mozambique, Namibia, Lesotho, South Africa, Seychelles, Swaziland, Zambia and Zimbabwe.",Nomalungelo Maphanga,Africa,Multiple countries,NA,Talarify OLS 6 project (https://openlifesci.org/ols-6/projects-participants/#mapping-the-rsse-landscape-in-africa),NA,Zambia,ZMB,-15,30
Biosafety South Africa,https://biosafety.org.za/,"Biosafety South Africa is a national technology platform in service of the country’s biotech regulators, researchers, technology developers and public.

Our mandate is to enable safe, sustainable and compliant research, development, production, use and application of biotechnology - in particular GMOs. We are an initiative of the Department of Science and Technology and funded entirely from public sources.
",Research organisation,NA,Nomalungelo Maphanga,Africa,South Africa,NA,Talarify OLS 6 project (https://openlifesci.org/ols-6/projects-participants/#mapping-the-rsse-landscape-in-africa),Cape Town,South Africa,ZAF,-29,24
Botswana Institute for Technology Research and Innovation (BITRI),http://www.bitri.co.bw/,"The Botswana Institute for Technology Research and Innovation (BITRI) is a parastatal under the Ministry of Tertiary Education, Research, Science and Technology, established in 2012, to conduct needs-based research and development in focused areas. The Mandate of BITRI is to identify, develop and/or adapt appropriate technology solutions that provides sustainable innovative solutions through co-creation and collaboration in line with national priorities and needs of Batswana.",Research organisation,NA,Nomalungelo Maphanga,Africa,Botswana,NA,Talarify OLS 6 project (https://openlifesci.org/ols-6/projects-participants/#mapping-the-rsse-landscape-in-africa),Botswana,Botswana,BWA,-22,24
CapeBio Technologies,https://web.facebook.com/CapeBioSA/?_rdc=1&_rdr,We leverage proprietary bio-discovery technology to enable development of “best-in-class” enzymes and assays. We use our proprietary technology for large scale biomanufacturing of our enzymes and assays.,Research organisation,NA,Nomalungelo Maphanga,Africa,South Africa,NA,Talarify OLS 6 project (https://openlifesci.org/ols-6/projects-participants/#mapping-the-rsse-landscape-in-africa),Pretoria,South Africa,ZAF,-29,24
Future Africa,https://www.futureafrica.science/,"Future Africa is a research institute and pan-African platform at the University of Pretoria that makes possible fundamentally new approaches to research and innovation that span disciplinary fields and geo-political boundaries. More specifically, through the efforts of a growing network of leading scientists and exceptional young talent, Future Africa is set to inspire science excellence to transform Africa and the world.",Research organisation,NA,Nomalungelo Maphanga,Africa,South Africa,NA,Talarify OLS 6 project (https://openlifesci.org/ols-6/projects-participants/#mapping-the-rsse-landscape-in-africa),Pretoria,South Africa,ZAF,-29,24
Africa Business Integration (ABI),https://www.4ir-abi.co.za/,An African Artificial Intelligence systems integration Lab with a mission to empower African developers and businesses with Artificial Intelligence systems and tools.,Research organisation,NA,Nomalungelo Maphanga,Africa,South Africa,NA,Talarify OLS 6 project (https://openlifesci.org/ols-6/projects-participants/#mapping-the-rsse-landscape-in-africa),Cape Town,South Africa,ZAF,-29,24
Africa R Users,https://r4africa.org/,"Africa R is a consortium of passionate Africa R user groups and users innovating with R every day, and are inspired to share their experience as well as communicate their findings to a global audience.",Community,NA,Anelda van der Walt,Africa,Multiple countries,NA,Talarify OLS 6 project (https://openlifesci.org/ols-6/projects-participants/#mapping-the-rsse-landscape-in-africa),NA,Zambia,ZMB,-15,30
Cape Town Python Users,https://ctpug.org.za/,"The Cape Town Python User Group meets once a month (or more), and holds discussions, talks and demos of whatever's currently interesting in the python world.",Community,NA,Anelda van der Walt,Africa,South Africa,NA,Talarify OLS 6 project (https://openlifesci.org/ols-6/projects-participants/#mapping-the-rsse-landscape-in-africa),NA,South Africa,ZAF,-29,24
Gauteng Python Users Group,https://www.meetup.com/Gauteng-Python-Users-Group/,"The GPUG is a diverse group of Pythonistas of varying backgrounds. Our themes focus on a variety of topics geared towards beginners and all the way to experts. Some topics we have covered in the past: AI, web development, data science, scripting, DevOps",Community,NA,Anelda van der Walt,Africa,South Africa,NA,Talarify OLS 6 project (https://openlifesci.org/ols-6/projects-participants/#mapping-the-rsse-landscape-in-africa),NA,South Africa,ZAF,-29,24
R-Ladies Cape Town,https://www.meetup.com/rladies-cape-town,R-Ladies Cape Town is part of R-Ladies Global and was founded to celebrate and promote gender diversity in the R community.,Community,NA,Anelda van der Walt,Africa,South Africa,NA,Talarify OLS 6 project (https://openlifesci.org/ols-6/projects-participants/#mapping-the-rsse-landscape-in-africa),NA,South Africa,ZAF,-29,24
R-Ladies Johannesburg,https://www.meetup.com/rladies-johannesburg,"R-Ladies Johannesburg welcomes members of all R proficiency levels, whether you're a new or aspiring R user, or an experienced R programmer interested in mentoring, networking & expert upskilling. Our non-profit, civil society community is designed to develop our members' R skills & knowledge through social, collaborative learning & sharing. Supporting minority identity access to STEM skills & careers, the Free Software Movement, and contributing to the global R community!",Community,NA,Anelda van der Walt,Africa,South Africa,NA,Talarify OLS 6 project (https://openlifesci.org/ols-6/projects-participants/#mapping-the-rsse-landscape-in-africa),NA,South Africa,ZAF,-29,24
R-Ladies Gabarone,https://www.meetup.com/rladies-gaborone,"R-Ladies Gaborone welcomes members of all R proficiency levels, whether you're a new or aspiring R user, or an experienced R programmer interested in mentoring, networking & expert upskilling. Our community is designed to develop our members' R skills & knowledge through social, collaborative learning & sharing. Supporting minority identity access to STEM skills & careers, the Free Software Movement, and contributing to the global R community!",Community,NA,Anelda van der Walt,Africa,Botswana,NA,Talarify OLS 6 project (https://openlifesci.org/ols-6/projects-participants/#mapping-the-rsse-landscape-in-africa),NA,Botswana,BWA,-22,24
R-Ladies Addis Ababa,https://www.meetup.com/rladies-addis-ababa,"This is a local chapter of R-Ladies Global ( https://www.rladies.org ), an organisation that promotes gender diversity in the R community worldwide. We meetup in person or virtually to learn about the R programming language, algorithms and advanced tools.
",Community,NA,Anelda van der Walt,Africa,Ethiopia,NA,Talarify OLS 6 project (https://openlifesci.org/ols-6/projects-participants/#mapping-the-rsse-landscape-in-africa),NA,Ethiopia,ETH,8,38
DakaR R User Group,https://www.meetup.com/DakaR-R-User-Group/,"Welcome to the Dakar User Group R, R is a free and open source programming language / software for data analysis and visualization. The goal of the Dakar R User Group is to bring together experienced and aspiring R users with different background and field of interest living in Dakar (Sénégal). We also aim at promoting R and the use of open source software for statistical analysis throughout the country in particular and in West-Africa in general.",Community,NA,Anelda van der Walt,Africa,Senegal,NA,Talarify OLS 6 project (https://openlifesci.org/ols-6/projects-participants/#mapping-the-rsse-landscape-in-africa),NA,Senegal,SEN,14,-14
Bamako Data Science,https://www.meetup.com/Bamako-Data-Science/,"Bamako Data Science is meant for everyone who wants to contribute to building a community around Data Science in Bamako. Whether you use R, Python or another programming language, it's meant to be a place for you to share what you do and to find people you can learn from or with. Hopefully, together we'll make it a platform where new ideas emerge, and collaboration starts.",Community,NA,Anelda van der Walt,Africa,Mali,NA,Talarify OLS 6 project (https://openlifesci.org/ols-6/projects-participants/#mapping-the-rsse-landscape-in-africa),NA,Mali,MLI,17,-4
Abidjan R users Meetup,https://www.meetup.com/Abidjan-R-users-Meetup/,This group is therefore intended for young Ivorians in love with technology and data and eager to disrupt the status quo in technology and data analysis.,Community,NA,Anelda van der Walt,Africa,Ivory Coast,NA,Talarify OLS 6 project (https://openlifesci.org/ols-6/projects-participants/#mapping-the-rsse-landscape-in-africa),NA,Ivory Coast,CIV,8,-5
Abidjan R users Meetup,https://www.meetup.com/Abidjan-R-users-Meetup/,This group is therefore intended for young Ivorians in love with technology and data and eager to disrupt the status quo in technology and data analysis.,Community,NA,Anelda van der Walt,Africa,Ivory Coast,NA,Talarify OLS 6 project (https://openlifesci.org/ols-6/projects-participants/#mapping-the-rsse-landscape-in-africa),NA,Ivory Coast,CIV,8,-5
Lagos R User Group,https://www.lagosrusers.com/,NA,Community,NA,Anelda van der Walt,Africa,Nigeria,NA,Talarify OLS 6 project (https://openlifesci.org/ols-6/projects-participants/#mapping-the-rsse-landscape-in-africa),NA,Nigeria,NGA,10,8
University of Ibadan R Users Group (UI RUG),https://www.meetup.com/University-of-Ibadan-R-Users-Group-UI-RUG/,UI RUG is a group of R enthusiasts based in the Department of Statistics University of Ibadan Nigeria.,Community,NA,Anelda van der Walt,Africa,Nigeria,NA,Talarify OLS 6 project (https://openlifesci.org/ols-6/projects-participants/#mapping-the-rsse-landscape-in-africa),NA,Nigeria,NGA,10,8
Vuna SDC,https://www.meetup.com/Vuna-SDC-R-user-group/,"Developers and designers in Abuja, Federal Capital Territory, Nigerian and others around , that are passionate and curious to learn new skills and technologies.",Community,NA,Anelda van der Walt,Africa,Nigeria,NA,Talarify OLS 6 project (https://openlifesci.org/ols-6/projects-participants/#mapping-the-rsse-landscape-in-africa),NA,Nigeria,NGA,10,8
Bauchi R User Group (BauchiRUG),https://www.meetup.com/Bauchi-R-User-Group-BauchiRUG/,"BauchiRUG is a group for R users at all levels (Beginners, Intermediate & Advanced) and from all backgrounds based in Bauchi State and the North eastern part of Nigeria, to meet and discuss R-related topics and to promote the use of R.",Community,NA,Anelda van der Walt,Africa,Nigeria,NA,Talarify OLS 6 project (https://openlifesci.org/ols-6/projects-participants/#mapping-the-rsse-landscape-in-africa),NA,Nigeria,NGA,10,8
R User Group Kano,https://www.meetup.com/r-user-group-kano/,"Kano RUG is a community of R users and enthusiasts from the industry and academia. The community welcome all users at all skill levels who are based in Kano state of Nigeria. We organize meet-ups to learn, connect and discuss about R-programming and related topics as well as to promote the use of R in our statistical projects.",Community,NA,Anelda van der Walt,Africa,Nigeria,NA,Talarify OLS 6 project (https://openlifesci.org/ols-6/projects-participants/#mapping-the-rsse-landscape-in-africa),NA,Nigeria,NGA,10,8
Tunis R User Group,https://www.meetup.com/tunis-r-user-group/,"Tunis R User Group is part of an international mentorship group with a focus on helping more people become active participants and leaders in the R open-source community. Our mission is to promote, educate and advance a diverse R community through outreach, education, conferences, events and social gatherings.",Community,NA,Anelda van der Walt,Africa,Tunisia,NA,Talarify OLS 6 project (https://openlifesci.org/ols-6/projects-participants/#mapping-the-rsse-landscape-in-africa),NA,Tunisia,TUN,34,9
Algiers R User Group,https://web.facebook.com/groups/671457203450306?_rdc=1&_rdr,"This group strives to connect the R user community, in Algiers and near Algiers to promote the sharing membership knowledge and their experiences",Community,NA,Anelda van der Walt,Africa,Algeria,NA,Talarify OLS 6 project (https://openlifesci.org/ols-6/projects-participants/#mapping-the-rsse-landscape-in-africa),NA,Algeria,DZA,28,3
Botswana R Users,https://www.meetup.com/Botswana-R-Users/,This is a group for all those interested in R. In this group we share and learn from each other R programming tools and techniques. You are all welcome to join the group.,Community,NA,Anelda van der Walt,Africa,Botswana,NA,Talarify OLS 6 project (https://openlifesci.org/ols-6/projects-participants/#mapping-the-rsse-landscape-in-africa),NA,Botswana,BWA,-22,24
Johannesburg R User Group (R Programming Language),https://www.meetup.com/Joburg-R-Users-Group/,"Our purpose is to bring R users together to help each other with common problems, exchange knowledge and share experiences.

Secondly, this group intends to spread the use of R in South Africa and show others (also non-R users) the benefits of using R.",Community,NA,Anelda van der Walt,Africa,South Africa,NA,Talarify OLS 6 project (https://openlifesci.org/ols-6/projects-participants/#mapping-the-rsse-landscape-in-africa),NA,South Africa,ZAF,-29,24
EswatiniUseR Group,https://www.meetup.com/EswatiniUseR/,This is a group for anyone interested in learning and sharing best practices in analyzing data in R,Community,NA,Anelda van der Walt,Africa,Eswatini,NA,Talarify OLS 6 project (https://openlifesci.org/ols-6/projects-participants/#mapping-the-rsse-landscape-in-africa),Talarify OLS 6 project (https://openlifesci.org/ols-6/projects-participants/#mapping-the-rsse-landscape-in-africa),Eswatini,SWZ,-26.5,31.5
R-Ladies Rabat,https://www.meetup.com/rladies-rabat-ma,"







This is a local chapter of R-Ladies Global (https://www.rladies.org), an organisation that promotes gender diversity in the R community worldwide. We meetup in person or virtually to learn about the R programming language, algorithms and advanced tools.",Community,NA,Anelda van der Walt,Africa,Morocco,NA,Talarify OLS 6 project (https://openlifesci.org/ols-6/projects-participants/#mapping-the-rsse-landscape-in-africa),NA,Morocco,MAR,32,-5
R-Ladies Algiers,https://www.meetup.com/rladies-algiers/,"This is a local chapter of R-Ladies Global ( https://www.rladies.org ), an organisation that promotes gender diversity in the R community worldwide. We meetup in person or virtually to learn about the R programming language, algorithms and advanced tools.",Community,NA,Anelda van der Walt,Africa,Algeria,NA,Talarify OLS 6 project (https://openlifesci.org/ols-6/projects-participants/#mapping-the-rsse-landscape-in-africa),NA,Algeria,DZA,28,3
R-Ladies Tunis,https://www.meetup.com/rladies-tunis/,"This is a local chapter of R-Ladies Global ( https://www.rladies.org ), an organisation that promotes gender diversity in the R community worldwide. We meetup in person or virtually to learn about the R programming language, algorithms and advanced tools.
",Community,NA,Anelda van der Walt,Africa,Tunisia,NA,Talarify OLS 6 project (https://openlifesci.org/ols-6/projects-participants/#mapping-the-rsse-landscape-in-africa),NA,Tunisia,TUN,34,9
R-Ladies Al-Khartum,https://www.meetup.com/rladies-al-khartum/,"R-Ladies welcomes members of all R proficiency levels, whether you're a new or aspiring R user, or an experienced R programmer interested in mentoring, networking & expert upskilling. Our community is designed to develop our members' R skills & knowledge through social, collaborative learning & sharing. Supporting minority identity access to STEM skills & careers, the Free Software Movement, and contributing to the global R community!",Community,NA,Anelda van der Walt,Africa,Sudan,NA,Talarify OLS 6 project (https://openlifesci.org/ols-6/projects-participants/#mapping-the-rsse-landscape-in-africa),NA,Sudan,SDN,15,30
R-Ladies Abuja,https://www.meetup.com/rladies-abuja,"This group is a local chapter of the R-Ladies Global organization in Abuja FCT, Nigeria. It is open to all members interested in the r programming language, data science, data analytics, and artificial intelligence. The group is focused on increasing the representation of women in the global R community through establishing local communities providing mentoring, collaborative learning & support. We are also open to collaboration from professionals, academics, and organizations willing to provide guidance and support to all members.",Community,NA,Anelda van der Walt,Africa,Nigeria,NA,Talarify OLS 6 project (https://openlifesci.org/ols-6/projects-participants/#mapping-the-rsse-landscape-in-africa),NA,Nigeria,NGA,10,8
R-Ladies Cotonou,https://www.meetup.com/rladies-cotonou,"R-Ladies Cotonou welcomes members of all R proficiency levels, whether you're a new or aspiring R user, or an experienced R programmer interested in mentoring, networking & expert upskilling. Our community is designed to develop our members' R skills & knowledge through social, collaborative learning & sharing. Supporting minority identity access to STEM skills & careers, the Free Software Movement, and contributing to the global R community!",Community,NA,Anelda van der Walt,Africa,Benin,NA,Talarify OLS 6 project (https://openlifesci.org/ols-6/projects-participants/#mapping-the-rsse-landscape-in-africa),NA,Benin,BEN,9.5,2.25
R-Ladies Lagos,https://www.meetup.com/rladies-lagos,"R-Ladies welcomes members of all R proficiency levels, whether you're a new or aspiring R user, or an experienced R programmer interested in mentoring, networking & expert upskilling. Our community is designed to develop our members' R skills & knowledge through social, collaborative learning & sharing. Supporting minority identity access to STEM skills & careers, the Free Software Movement, and contributing to the global R community!",Community,NA,Anelda van der Walt,Africa,Nigeria,NA,Talarify OLS 6 project (https://openlifesci.org/ols-6/projects-participants/#mapping-the-rsse-landscape-in-africa),NA,Nigeria,NGA,10,8
R-Ladies Yaoundé,https://www.meetup.com/rladies-yaounde,"This is a local chapter of R-Ladies Global ( https://www.rladies.org ), an organisation that promotes gender diversity in the R community worldwide. We meetup in person or virtually to learn about the R programming language, algorithms and advanced tools.",Community,NA,Anelda van der Walt,Africa,Cameroon,NA,Talarify OLS 6 project (https://openlifesci.org/ols-6/projects-participants/#mapping-the-rsse-landscape-in-africa),NA,Cameroon,CMR,6,12
R-Ladies Accra,https://www.meetup.com/rladies-accra/,"This is a local chapter of R-Ladies Global (https://www.rladies.org), an organisation that promotes gender diversity in the R community worldwide. We meetup in person or virtually to learn about the R programming language, algorithms and advanced tools.",Community,NA,Anelda van der Walt,Africa,Ghana,NA,Talarify OLS 6 project (https://openlifesci.org/ols-6/projects-participants/#mapping-the-rsse-landscape-in-africa),NA,Ghana,GHA,8,-2
Africa Python,https://africa.python.org/,Sharing information about Python and Python events in Africa,Community,NA,Anelda van der Walt,Africa,Multiple countries,NA,Talarify OLS 6 project (https://openlifesci.org/ols-6/projects-participants/#mapping-the-rsse-landscape-in-africa),NA,Zambia,ZMB,-15,30
"KwaZulu-Natal Research Innovation and Sequencing Platform (KRISP), University of KwaZulu-Natal",https://h3abionet.org/nodes/ukzn,"KRISP at UKZN challenges the status quo to create a scientific environment in (South) Africa that delivers high level science, creates innovations and reverses the brain drain.",Research organisation,H3ABionet node,Anelda van der Walt,Africa,South Africa,NA,Talarify OLS 6 project (https://openlifesci.org/ols-6/projects-participants/#mapping-the-rsse-landscape-in-africa),NA,South Africa,ZAF,-29,24
"Rhodes University, Research Unit in Bioinformatics, RUBi",https://rubi.ru.ac.za/,Bioinformatics,Research group,H3ABionet node,Anelda van der Walt,Africa,South Africa,NA,Talarify OLS 6 project (https://openlifesci.org/ols-6/projects-participants/#mapping-the-rsse-landscape-in-africa),NA,South Africa,ZAF,-29,24
