Name,Website,Initiatives_aims,Type,Other_information,Collector,Region,Country,Tag,Data_origin,Spec_location,Mapping_location,country_iso,Latitude,Longitude
Computational Biology division at the University of Cape Town (CBIO),http://www.cbio.uct.ac.za/,"The Computational Biology (CBIO) division at the University of Cape Town (UCT) is the centre of bioinformatics activities at the university. It forms part of the Department of Integrative Biomedical Sciences and is located within the Institute of Infectious Disease and Molecular Medicine (IDM), in the Faculty of Health Sciences. The division carries out research in a number of areas, and provides training and services in the discipline.",Research group,"The CBIO division at UCT leads H3ABioNet, an NIH-funded Pan African bioinformatics network for H3Africa.",Nomalungelo Maphanga,Africa,South Africa,NA,Talarify OLS 6 project (https://openlifesci.org/ols-6/projects-participants/#mapping-the-rsse-landscape-in-africa),Cape Town,South Africa,ZAF,-29,24
NWU Centre for Text Technology (CText),https://sadilar.org/index.php/en/about/sadilar-nodes/nwu-centre-for-text-technology-ctext,"As the official text node of SADiLaR, CTexT® focuses on the advancement of multilingualism and building indigenous South African languages. For under-resourced languages, text data isn’t as available as it is for English, for example, and yet this is needed if new technologies within big data and artificial intelligence (AI), responsive to the unique South African context, are to be developed.",Research group,SADiLaR Node. More about SADiLaR: https://sadilar.org/index.php/en/,Nomalungelo Maphanga,Africa,South Africa,NA,Talarify OLS 6 project (https://openlifesci.org/ols-6/projects-participants/#mapping-the-rsse-landscape-in-africa),Potchefstroom,South Africa,ZAF,-29,24
South African Radio Astronomy Observatory (SARAO),https://www.sarao.ac.za/,"The South African Radio Astronomy Observatory (SARAO), a facility of the National Research Foundation, is responsible for managing all radio astronomy initiatives and facilities in South Africa, including the MeerKAT Radio Telescope in the Karoo, and the Geodesy and VLBI activities at the HartRAO facility. SARAO also coordinates the African Very Long Baseline Interferometry Network (AVN) for the eight SKA partner countries in Africa, as well as South Africa’s contribution to the infrastructure and engineering planning for the Square Kilometre Array Radio Telescope. To maximise the return on South Africa’s investment in radio astronomy, SARAO is managing programmes to create capacity in radio astronomy science and engineering research, and the technical capacity required to support site operations.",Research organisation,NA,Nomalungelo Maphanga,Africa,South Africa,NA,Talarify OLS 6 project (https://openlifesci.org/ols-6/projects-participants/#mapping-the-rsse-landscape-in-africa),"Cape Town, Klerefontein, Carnarvon, Hartebeesthoek",South Africa,ZAF,-29,24
African Institute for Mathematical Sciences (South Africa),https://aims.ac.za/,"The African Institute for Mathematical Sciences (AIMS) is a pan-African network of Centres of Excellence for post-graduate training in mathematical sciences, research and public engagement in Science, Technology, Engineering and Mathematics (STEM). AIMS is enabling Africa’s talented students to become innovators driving the continent’s scientific, educational and economic self-sufficiency.",Research organisation,NA,Nomalungelo Maphanga,Africa,South Africa,NA,Talarify OLS 6 project (https://openlifesci.org/ols-6/projects-participants/#mapping-the-rsse-landscape-in-africa),Cape Town,South Africa,ZAF,-29,24
South African National Space Agency (SANSA),https://www.sansa.org.za/,"The research and work carried out at SANSA focuses on space science, engineering and technology that can promote development, build human capital and provide important national services. Much of this work involves monitoring the Earth and our surrounding environment, and using the collected data to ensure that navigation, communication technology and weather forecasting services function as intended.",Research organisation,NA,Nomalungelo Maphanga,Africa,South Africa,NA,Talarify OLS 6 project (https://openlifesci.org/ols-6/projects-participants/#mapping-the-rsse-landscape-in-africa),"Pretoria, Hermanus",South Africa,ZAF,-29,24
Inter-university Institute for Data Intensive Astronomy (IDIA),https://www.idia.ac.za/,The overarching goal of IDIA is to build within the South African university research community the capacity and expertise in data intensive research to enable global leadership on MeerKAT large survey science projects and large projects on other SKA pathfinder telescopes.,Research organisation,"The Inter-university Institute for Data Intensive Astronomy is a partnership of three South African universities, the Universities of Cape Town, of the Western Cape and of Pretoria as well as the South African Radio Astronomy Observatory.",Nomalungelo Maphanga,Africa,South Africa,NA,Talarify OLS 6 project (https://openlifesci.org/ols-6/projects-participants/#mapping-the-rsse-landscape-in-africa),NA,South Africa,ZAF,-29,24
Data Intensive Research Initiative of South Africa (DIRISA),https://www.dirisa.ac.za/,"Provide a range of research data management services including User Subscription, Data Management Planning, Data Deposit and DOI Minting",Research infrastructure,DIRISA IS is one of the components of the National Integrated Cyberinfrastructure System (NICIS) managed by CSIR,Nomalungelo Maphanga,Africa,South Africa,NA,Talarify OLS 6 project (https://openlifesci.org/ols-6/projects-participants/#mapping-the-rsse-landscape-in-africa),Pretoria,South Africa,ZAF,-29,24
Centre for High Performance Computing (CHPC),https://www.chpc.ac.za/,"The CHPC is one of three primary pillars of the national cyber-infrastructure intervention supported by the Department of Science and Technology (DST). The South African National Research Network (SANReN) and the Data Intensive Research Infrastructure of South Africa (DIRISA) complement the CHPC through the provision of high-speed, high-bandwidth connectivity, and the effective curation of a variety of notably large and critical databases. The CHPC infrastructure is updated and maintained meticulously to comply with international standards.",Research infrastructure,NA,Nomalungelo Maphanga,Africa,South Africa,NA,Talarify OLS 6 project (https://openlifesci.org/ols-6/projects-participants/#mapping-the-rsse-landscape-in-africa),Cape Town,South Africa,ZAF,-29,24
Council for Scientific and Industrial Research (CSIR),https://www.csir.co.za/,"“The objects of the CSIR are, through directed and particularly multi-disciplinary research and technological innovation, to foster, in the national interest and in fields which in its opinion should receive preference, industrial and scientific development, either by itself or in co-operation with principals from the private or public sectors, and thereby to contribute to the improvement of the quality of life of the people of the Republic, and to perform any other functions that may be assigned to the CSIR by or under this Act.” (Scientific Research Council Act 46 of 1988, amended by Act 71 of 1990)",Research organisation,NA,Nomalungelo Maphanga,Africa,South Africa,NA,Talarify OLS 6 project (https://openlifesci.org/ols-6/projects-participants/#mapping-the-rsse-landscape-in-africa),Pretoria,South Africa,ZAF,-29,24
ZINDI,https://zindi.africa/,"Zindi is a social enterprise whose mission is to build the data science ecosystem in Africa. Our vision is for a vibrant community of data scientists across Africa, mobilized towards solving the region’s most pressing problems.",Community,NA,Nomalungelo Maphanga,Africa,Multiple countries,NA,Talarify OLS 6 project (https://openlifesci.org/ols-6/projects-participants/#mapping-the-rsse-landscape-in-africa),NA,Zambia,ZMB,-15,30
"DSI-NRF Centre of Excellence in Epidemiological Modelling and Analysis
 (SACEMA)",https://www.sacema.org/,"SACEMA's mission is to improve health in Africa, and particularly South Africa, through epidemiological modelling and analysis. Trained in mathematics, biology, physics, statistics, and epidemiology, SACEMA researchers bridge disciplines to understand disease dynamics and improve real-world outcomes. This involves tackling complex health scenarios and developing tools that allow decision makers to navigate uncertainty. We work with a wide variety of health issues, including HIV, TB, vaccine-preventable diseases, emerging infections, cancer, and diabetes.",Research organisation,NA,Nomalungelo Maphanga,Africa,South Africa,NA,Talarify OLS 6 project (https://openlifesci.org/ols-6/projects-participants/#mapping-the-rsse-landscape-in-africa),Stellenbosch,South Africa,ZAF,-29,24
South African Society for Bioinformatics (SASBi),http://sasbi.weebly.com/,"SASBi is a national association, conscious of its African and international context as it seeks to promote the discipline of bioinformatics in all its facets, locally, regionally and internationally. It is committed to excellence in the learning, teaching and research of the discipline and will strive to explore the applications of bioinformatics and computational biology in addressing the needs of the South African society.",Community,NA,Nomalungelo Maphanga,Africa,South Africa,NA,Talarify OLS 6 project (https://openlifesci.org/ols-6/projects-participants/#mapping-the-rsse-landscape-in-africa),NA,South Africa,ZAF,-29,24
Office of Astronomy for Development (OAD),https://www.astro4dev.org/,"The mission of the OAD is to help further the use of astronomy, including its practitioners, skills and infrastructures, as a tool for development by mobilizing the human and financial resources necessary in order to realize the field’s scientific, technological and cultural benefits to society.",Research organisation,"The OAD is a joint project of the International Astronomical Union (IAU) and the South African National Research Foundation (NRF) with the support of the Department of Science and Innovation (DSI). The OAD has established nine regional offices around the world – in Armenia, China, Colombia, Ethiopia, Jordan, Nigeria, Portugal, Thailand and Zambia. As of 2020, this has  grown to 11 Regional Offices, with the addition of Europe and North America.",Nomalungelo Maphanga,Africa,South Africa,NA,Talarify OLS 6 project (https://openlifesci.org/ols-6/projects-participants/#mapping-the-rsse-landscape-in-africa),Cape Town,South Africa,ZAF,-29,24
Research Software and Systems Engineers of Africa (RSSE Africa),https://rsse.africa/,"A forum for Research Software & Systems Engineers on the African continent that aims to share skills and opportunities and improve equity, diversity and inclusion within the research software and systems engineering (RSSE) space.",Community,NA,Nomalungelo Maphanga,Africa,South Africa,NA,Talarify OLS 6 project (https://openlifesci.org/ols-6/projects-participants/#mapping-the-rsse-landscape-in-africa),NA,South Africa,ZAF,-29,24
Code for Africa,https://medium.com/code-for-africa,"Code for Africa (CfA) is the continent’s largest network of civic technology and data journalism labs, with teams in 20 countries. CfA builds digital democracy solutions that give citizens unfettered access to actionable information that empowers them to make informed decisions, and which strengthens civic engagement for improved public governance and accountability. This includes building infrastructure like the continent’s largest open data portals at openAFRICA and sourceAFRICA, as well as incubating initiatives as diverse as the africanDRONE network, the PesaCheck fact-checking initiative and the sensors.AFRICA air quality sensor network.",Community,NA,Nomalungelo Maphanga,Africa,Multiple countries,NA,Talarify OLS 6 project (https://openlifesci.org/ols-6/projects-participants/#mapping-the-rsse-landscape-in-africa),NA,Zambia,ZMB,-15,30
The Carpentries,https://docs.carpentries.org/index.html,"The Carpentries teaches foundational coding, and data science skills to researchers worldwide.",Community,NA,Nomalungelo Maphanga,Africa,Multiple countries,NA,Talarify OLS 6 project (https://openlifesci.org/ols-6/projects-participants/#mapping-the-rsse-landscape-in-africa),"South Africa, Botswana, Tunisia, Tanzania and Kenya",Zambia,ZMB,-15,30
South African Genetic society (SAGS),https://sagene.co.za/,"SAGS assists and advises on the establishment of standards of teaching, training and research in genetics in South Africa. It also communicates information to the general public on the value of historic and new developments in genetics, and encourages education and training in this regard. The Society strives to facilitate multi-disciplinary and multi-institutional scientific co-operation in genetics, in the context of Southern Africa and Africa. It supports and fosters genetics through congresses, symposia, workshops, newsletters, and publications, including this website",Community,NA,Nomalungelo Maphanga,Africa,South Africa,NA,Talarify OLS 6 project (https://openlifesci.org/ols-6/projects-participants/#mapping-the-rsse-landscape-in-africa),NA,South Africa,ZAF,-29,24
Code for South Africa,http://code4sa.org/,Code for South Africa is a non-profit civic technology lab. We use data and technology to promote informed decision-making that drives social change.,Community,Changed to OpenUp,Nomalungelo Maphanga,Africa,South Africa,NA,Talarify OLS 6 project (https://openlifesci.org/ols-6/projects-participants/#mapping-the-rsse-landscape-in-africa),NA,South Africa,ZAF,-29,24
OpenUp,https://openup.org.za/,"build tools, open up data, and provide data training which supports an active citizenry and helps communities and governments work better, together.",Civic Tech organisation,Previously Code for South Africa,Nomalungelo Maphanga,Africa,South Africa,NA,Talarify OLS 6 project (https://openlifesci.org/ols-6/projects-participants/#mapping-the-rsse-landscape-in-africa),NA,South Africa,ZAF,-29,24
South African Medical Research Council (SAMRC),https://www.samrc.ac.za/,"to improve the health of the country’s population, through research, development and technology transfer, so that people can enjoy a better quality of life. The scope of the organisation’s research projects includes tuberculosis, HIV/AIDS, cardiovascular and non-communicable diseases, gender and health, and alcohol and other drug abuse. With a strategic objective to help strengthen the health systems of the country – in line with that of the Department of Health, the SAMRC constantly identifies the main causes of death in South Africa.",Research organisation,NA,Nomalungelo Maphanga,Africa,South Africa,NA,Talarify OLS 6 project (https://openlifesci.org/ols-6/projects-participants/#mapping-the-rsse-landscape-in-africa),NA,South Africa,ZAF,-29,24
Human Science Research Council (HSRC),https://hsrc.ac.za/,"The HSRC will be a national, regional and global leader in the production and dissemination of transformative social science and humanities research in the interests of a just and equal soThe HSRC produces leading-edge policy research, through engaged scholarship, to utilise in understanding and  explaining social conditions and informing social change for inclusive growth in communities.",Research organisation,NA,Nomalungelo Maphanga,Africa,South Africa,NA,Talarify OLS 6 project (https://openlifesci.org/ols-6/projects-participants/#mapping-the-rsse-landscape-in-africa),NA,South Africa,ZAF,-29,24
African Population and Health Research Center (APHRC),https://aphrc.org/,APHRC is committed to generating an Africa-led and Africa-owned body of evidence to inform decision making for an effective and sustainable response to the most critical challenges facing the continent.,Research organisation,NA,Nomalungelo Maphanga,Africa,Kenya,NA,Talarify OLS 6 project (https://openlifesci.org/ols-6/projects-participants/#mapping-the-rsse-landscape-in-africa),NA,Kenya,KEN,1,38
afrimapr,https://afrimapr.org/,afrimapr creates R building blocks and learning resources to make it easier to make data-driven maps in Africa.,Community,NA,Nomalungelo Maphanga,Africa,South Africa,NA,Talarify OLS 6 project (https://openlifesci.org/ols-6/projects-participants/#mapping-the-rsse-landscape-in-africa),NA,South Africa,ZAF,-29,24
South Africa R User Groups,https://www.rusergroup.co.za/,"Our purpose is to bring R users together to help each other with common problems, exchange knowledge and share experiences. Secondly, this group intends to spread the use of R in South Africa and show others (also non-R users) the benefits of using R.",Community,NA,Nomalungelo Maphanga,Africa,South Africa,NA,Talarify OLS 6 project (https://openlifesci.org/ols-6/projects-participants/#mapping-the-rsse-landscape-in-africa),NA,South Africa,ZAF,-29,24
The Carpentries in Africa,https://docs.carpentries.org/topic_folders/regional_communities/african_task_force.html,"The Carpentries builds global capacity in essential data and computational skills for conducting efficient, open, and reproducible research. We train and foster an active, inclusive, diverse community of learners and instructors that promotes and models the importance of software and data in research. We collaboratively develop openly-available lessons and deliver these lessons using evidence-based teaching practices. We focus on people conducting and supporting research.",Community,NA,Nomalungelo Maphanga,Africa,South Africa,NA,Talarify OLS 6 project (https://openlifesci.org/ols-6/projects-participants/#mapping-the-rsse-landscape-in-africa),NA,South Africa,ZAF,-29,24
National Water Research Center (NWRC),South Africa,"

The National Water Research Center (NWRC) is a pioneer institution for various water research activities in Egypt. It was established in 1975 as a research entity within the Ministry of Water Res ources and Irrigation (MWRI). Under the umbrella of NWRC, twelve research institutes exert concerted efforts to implement a comprehensive research plan serving on-going projects and national development plans in general.

Each of the twelve institutes is concerned with one research discipline in the field of water engineering and related water issues. Besides, NWRC established a Strategic Research Unit, a Central Laboratory for Environmental Quality Monitoring, a Geographic Information System, Information/ Documentation Center, and a highly specialized Central Library.",Research organisation,NA,Nomalungelo Maphanga,Africa,Egypt,NA,Talarify OLS 6 project (https://openlifesci.org/ols-6/projects-participants/#mapping-the-rsse-landscape-in-africa),NA,Egypt,EGY,27,30
South African Astronomical Observatory (SAAO),https://www.saao.ac.za/,"To utilise the knowledge, technology and other available resources within the SAAO and similar institutions in order to facilitate education enhancement, science communication, socio-economic development and public engagement and thereby contribute to the improvement of the quality of life of all people within reach.",Research organisation,NA,Nomalungelo Maphanga,Africa,South Africa,NA,Talarify OLS 6 project (https://openlifesci.org/ols-6/projects-participants/#mapping-the-rsse-landscape-in-africa),NA,South Africa,ZAF,-29,24
Kenya Medical Research Institute (KEMRI),https://www.kemri.go.ke/,"National diseases surveillance and rapid response capacity for major disease outbreaks (Cholera, Chikungunya Virus, H1N1 Flu, Yellow Fever, Rift Valley Fever, Ebola, Aflatoxicosis etc). In line with the constitutional requirements, KEMRI has developed a comprehensive framework under which the Institute has devolved its research activities and services, through seven regional clusters that serves the forty seven counties under the strategic pillar of health research in the context of devolution. Technical and research support for the Emergency Care of Critically Ill Children (ETAT) guidelines. KEMRI provided Technical Facilitation in development of National Guidelines for Prevention of Cervix, Breast and Prostate cancers. Developed a curriculum and guidelines on biosafety and biosecurity for Health Care Workers in collaboration with MOH. Rationalization and regulation of traditional medicine. Human resource capacity development for research though attachments and in the KEMRI-JKUAT",Research organisation,NA,Nomalungelo Maphanga,Africa,Kenya,NA,Talarify OLS 6 project (https://openlifesci.org/ols-6/projects-participants/#mapping-the-rsse-landscape-in-africa),NA,Kenya,KEN,1,38
World Agroforestry (ICRAF),https://www.worldagroforestry.org/,"Leveraging the world’s largest repository of agroforestry science and information, we develop knowledge practices, from farmers’ fields to the global sphere, to ensure food security and environmental sustainability. Our vision is an equitable world where all people have viable livelihoods supported by healthy and productive landscapes.",Research organisation,NA,Nomalungelo Maphanga,Africa,Multiple countries,NA,Talarify OLS 6 project (https://openlifesci.org/ols-6/projects-participants/#mapping-the-rsse-landscape-in-africa),"Eswatini Zambia, Cameroon
Côte d’Ivoire
Democratic Republic of Congo(DRC)
Mali
Niger
Nigeria
Ethiopia
Kenya
Lesotho
Malawi
Rwanda
Somalia
Tanzania",Zambia,ZMB,-15,30
African Institute for Mathematical Sciences (Rwanda),https://aims.ac.rw/our-global-secretariat/,"The African Institute for Mathematical Sciences (AIMS) is a pan-African network of Centres of Excellence for post-graduate training in mathematical sciences, research and public engagement in Science, Technology, Engineering and Mathematics (STEM). AIMS is enabling Africa’s talented students to become innovators driving the continent’s scientific, educational and economic self-sufficiency.",Research organisation,NA,Nomalungelo Maphanga,Africa,Rwanda,NA,Talarify OLS 6 project (https://openlifesci.org/ols-6/projects-participants/#mapping-the-rsse-landscape-in-africa),NA,Rwanda,RWA,-2,30
African Institute for Mathematical Sciences (Senegal),https://aims-senegal.org/,"The African Institute for Mathematical Sciences (AIMS) is a pan-African network of Centres of Excellence for post-graduate training in mathematical sciences, research and public engagement in Science, Technology, Engineering and Mathematics (STEM). AIMS is enabling Africa’s talented students to become innovators driving the continent’s scientific, educational and economic self-sufficiency.",Research organisation,NA,Nomalungelo Maphanga,Africa,Senegal,NA,Talarify OLS 6 project (https://openlifesci.org/ols-6/projects-participants/#mapping-the-rsse-landscape-in-africa),NA,Senegal,SEN,14,-14
African Institute for Mathematical Sciences (Ghana),https://aims.edu.gh/,"The African Institute for Mathematical Sciences (AIMS) is a pan-African network of Centres of Excellence for post-graduate training in mathematical sciences, research and public engagement in Science, Technology, Engineering and Mathematics (STEM). AIMS is enabling Africa’s talented students to become innovators driving the continent’s scientific, educational and economic self-sufficiency.",Research organisation,NA,Nomalungelo Maphanga,Africa,Ghana,NA,Talarify OLS 6 project (https://openlifesci.org/ols-6/projects-participants/#mapping-the-rsse-landscape-in-africa),NA,Ghana,GHA,8,-2
International Centre of Insect Physiology and Ecology (ICIPE),http://www.icipe.org/,"The Centre’s mission is to use insect science for sustainable development, to ensure food security and improve the overall health of communities in Africa by addressing the interlinked problems of poverty, poor health, low agricultural productivity and environmental degradation.",Research organisation,NA,Nomalungelo Maphanga,Africa,Kenya,NA,Talarify OLS 6 project (https://openlifesci.org/ols-6/projects-participants/#mapping-the-rsse-landscape-in-africa),NA,Kenya,KEN,1,38
Medical Research Council Unit (The Gambia),https://www.mrc.gm/,"The Unit’s investigator-led research is underpinned by the combination of excellent laboratory facilities and easy access to the field with well-defined populations that are highly supportive of our research, excellent clinical services, rigorous ethical procedures and ability to deliver GCP-compliant clinical trials. Our large research portfolio spans basic research to the evaluation of interventions for the control of diseases of public health importance in sub-Saharan Africa.",Research organisation,NA,Nomalungelo Maphanga,Africa,Gambia,NA,Talarify OLS 6 project (https://openlifesci.org/ols-6/projects-participants/#mapping-the-rsse-landscape-in-africa),NA,Gambia,GMB,13.4667,-16.5667
National Institute for Communicable Diseases (NICD),https://www.nicd.ac.za/,"The National Institute for Communicable Diseases (NICD) is a national public health institute for South Africa, providing disease surveillance, specialised diagnostic services, outbreak response, public health research and capacity building to support the government’s response to communicable disease threats.",Research organisation,NA,Nomalungelo Maphanga,Africa,South Africa,NA,Talarify OLS 6 project (https://openlifesci.org/ols-6/projects-participants/#mapping-the-rsse-landscape-in-africa),Johannesburg,South Africa,ZAF,-29,24
National Health Laboratory Service (NHLS),https://www.nhls.ac.za/,"Its activities comprise of Diagnostic Laboratory Services, Research, Teaching and Training, and Production of Sera for Anti-Snake Venom, Reagents and Media.",Research organisation,NA,Nomalungelo Maphanga,Africa,South Africa,NA,Talarify OLS 6 project (https://openlifesci.org/ols-6/projects-participants/#mapping-the-rsse-landscape-in-africa),Johannesburg,South Africa,ZAF,-29,24
